{
  "schemaVersion": "agentic-501-correlation-event/v1",
  "eventId": "evt-rehearsal-0001",
  "eventType": "inference.completed",
  "observedAt": "2026-09-28T15:04:05Z",
  "runId": "run-rehearsal-501-0001",
  "journeyId": "journey-0007",
  "stepId": "analyst-generate",
  "attempt": 1,
  "component": "inference",
  "phase": "baseline",
  "otel": {
    "traceId": "4bf92f3577b34da6a3ce929d0e0e4736",
    "spanId": "00f067aa0ba902b7",
    "parentSpanId": "b7ad6b7169203331",
    "traceFlags": "01"
  },
  "provenance": {
    "evidenceClass": "rehearsal",
    "sourceSystem": "agentic-scale-501-fixture",
    "sourceRecordId": "fixture/inference-completed/0001",
    "collector": "static-example",
    "collectorVersion": "1.0.0",
    "payloadDigest": "sha256:aaaaaaaaaaaaaaaaaaaaaaaaaaaaaaaaaaaaaaaaaaaaaaaaaaaaaaaaaaaaaaaa",
    "clock": {
      "source": "fixture-clock",
      "synchronized": false,
      "maxErrorMs": 0
    },
    "captureMode": "fixture",
    "implementationStatus": "runtime-gated"
  },
  "attributes": {
    "agentic501.run.id": "run-rehearsal-501-0001",
    "agentic501.journey.id": "journey-0007",
    "agentic501.phase": "baseline",
    "agentic501.step.id": "analyst-generate",
    "agentic501.attempt": 1,
    "agentic501.evidence.class": "rehearsal",
    "agentic501.evidence.payload.sha256": "sha256:aaaaaaaaaaaaaaaaaaaaaaaaaaaaaaaaaaaaaaaaaaaaaaaaaaaaaaaaaaaaaaaa",
    "gen_ai.request.model": "example-model-not-a-live-claim",
    "gen_ai.usage.input_tokens": 0,
    "gen_ai.usage.output_tokens": 0,
    "server.address": "example.invalid"
  }
}
